{
  "schema_version": 1,
  "episode_date": "2026-09-25",
  "status": "resolve_bridge_v0_plan",
  "project": {
    "name": "AI News Daily · 2026-09-25",
    "timeline_name": "2026-09-25 · Rough Cut",
    "settings": {
      "timelineResolutionWidth": "3840",
      "timelineResolutionHeight": "2160",
      "timelineFrameRate": "30",
      "timelinePlaybackFrameRate": "30"
    }
  },
  "bins": [
    "00_OTIO_Imported",
    "01_A-Roll_Placeholders",
    "02_B-Roll",
    "03_Graphics",
    "99_Missing_B-Roll"
  ],
  "tracks": {
    "video": [
      {
        "index": 1,
        "name": "V1 · JC A-Roll"
      },
      {
        "index": 2,
        "name": "V2 · B-Roll / Evidence"
      },
      {
        "index": 3,
        "name": "V3 · Graphics"
      },
      {
        "index": 4,
        "name": "V4 · Titles"
      }
    ],
    "audio": [
      {
        "index": 1,
        "name": "A1 · JC Dialogue"
      }
    ]
  },
  "imports": [
    {
      "logical_repo_path": "multimedia/2026-09-25/B00_opening__E_none/S002__0004-0007s__cinematic-close-up-hands-highlighting-research-n.mp4",
      "absolute_path": "/home/runner/work/AI-News-Daily/AI-News-Daily/.pipeline-runs/2026-09-25/36467553743/multimedia/2026-09-25/B00_opening__E_none/S002__0004-0007s__cinematic-close-up-hands-highlighting-research-n.mp4",
      "bin": "02_B-Roll",
      "exists": true,
      "placeholder": false
    },
    {
      "logical_repo_path": "multimedia/2026-09-25/B00_opening__E_none/S003__0007-0010s__moving-archival-documents-handwritten-notes-desk.mp4",
      "absolute_path": "/home/runner/work/AI-News-Daily/AI-News-Daily/.pipeline-runs/2026-09-25/36467553743/multimedia/2026-09-25/B00_opening__E_none/S003__0007-0010s__moving-archival-documents-handwritten-notes-desk.mp4",
      "bin": "02_B-Roll",
      "exists": true,
      "placeholder": false
    },
    {
      "logical_repo_path": "multimedia/2026-09-25/B00_opening__E_none/S004__0010-0014s__investigative-evidence-wall-notes-connecting-lin.mp4",
      "absolute_path": "/home/runner/work/AI-News-Daily/AI-News-Daily/.pipeline-runs/2026-09-25/36467553743/multimedia/2026-09-25/B00_opening__E_none/S004__0010-0014s__investigative-evidence-wall-notes-connecting-lin.mp4",
      "bin": "02_B-Roll",
      "exists": true,
      "placeholder": false
    },
    {
      "logical_repo_path": "multimedia/2026-09-25/B00_opening__E_none/S005__0014-0018s__abstract-flowing-data-traces-light-paths-cinemat.mp4",
      "absolute_path": "/home/runner/work/AI-News-Daily/AI-News-Daily/.pipeline-runs/2026-09-25/36467553743/multimedia/2026-09-25/B00_opening__E_none/S005__0014-0018s__abstract-flowing-data-traces-light-paths-cinemat.mp4",
      "bin": "02_B-Roll",
      "exists": true,
      "placeholder": false
    },
    {
      "logical_repo_path": "multimedia/2026-09-25/B00_opening__E_none/S006__0018-0020s__person-carefully-reviewing-papers-computer-scree.mp4",
      "absolute_path": "/home/runner/work/AI-News-Daily/AI-News-Daily/.pipeline-runs/2026-09-25/36467553743/multimedia/2026-09-25/B00_opening__E_none/S006__0018-0020s__person-carefully-reviewing-papers-computer-scree.mp4",
      "bin": "02_B-Roll",
      "exists": true,
      "placeholder": false
    },
    {
      "logical_repo_path": "multimedia/2026-09-25/B00_opening__E_none/S007__0020-0024s__researcher-notes.jpg",
      "absolute_path": "/home/runner/work/AI-News-Daily/AI-News-Daily/.pipeline-runs/2026-09-25/36467553743/multimedia/2026-09-25/B00_opening__E_none/S007__0020-0024s__researcher-notes.jpg",
      "bin": "02_B-Roll",
      "exists": true,
      "placeholder": false
    },
    {
      "logical_repo_path": "multimedia/2026-09-25/B00_opening__E_none/S008__0030-0034s__researcher-notes-and-computer-close-up-documenta.mp4",
      "absolute_path": "/home/runner/work/AI-News-Daily/AI-News-Daily/.pipeline-runs/2026-09-25/36467553743/multimedia/2026-09-25/B00_opening__E_none/S008__0030-0034s__researcher-notes-and-computer-close-up-documenta.mp4",
      "bin": "02_B-Roll",
      "exists": true,
      "placeholder": false
    },
    {
      "logical_repo_path": "multimedia/2026-09-25/B00_opening__E_none/S011__0060-0064s__researcher-notes-and-computer-wide-documentary-s.jpg",
      "absolute_path": "/home/runner/work/AI-News-Daily/AI-News-Daily/.pipeline-runs/2026-09-25/36467553743/multimedia/2026-09-25/B00_opening__E_none/S011__0060-0064s__researcher-notes-and-computer-wide-documentary-s.jpg",
      "bin": "02_B-Roll",
      "exists": true,
      "placeholder": false
    },
    {
      "logical_repo_path": "multimedia/2026-09-25/B01_green-checkmark__E_none/S012__0066-0070s__abrir-con-la-escena-hipotetica-de-la-marca-verde.jpg",
      "absolute_path": "/home/runner/work/AI-News-Daily/AI-News-Daily/.pipeline-runs/2026-09-25/36467553743/multimedia/2026-09-25/B01_green-checkmark__E_none/S012__0066-0070s__abrir-con-la-escena-hipotetica-de-la-marca-verde.jpg",
      "bin": "02_B-Roll",
      "exists": true,
      "placeholder": false
    },
    {
      "logical_repo_path": "multimedia/2026-09-25/B01_green-checkmark__E_none/S014__0086-0090s__researcher-working-with-notes-hands-working-deta.jpg",
      "absolute_path": "/home/runner/work/AI-News-Daily/AI-News-Daily/.pipeline-runs/2026-09-25/36467553743/multimedia/2026-09-25/B01_green-checkmark__E_none/S014__0086-0090s__researcher-working-with-notes-hands-working-deta.jpg",
      "bin": "02_B-Roll",
      "exists": true,
      "placeholder": false
    },
    {
      "logical_repo_path": "multimedia/2026-09-25/B01_green-checkmark__E_none/S017__0116-0120s__researcher-working-with-notes-computer-screen-an.mp4",
      "absolute_path": "/home/runner/work/AI-News-Daily/AI-News-Daily/.pipeline-runs/2026-09-25/36467553743/multimedia/2026-09-25/B01_green-checkmark__E_none/S017__0116-0120s__researcher-working-with-notes-computer-screen-an.mp4",
      "bin": "02_B-Roll",
      "exists": true,
      "placeholder": false
    },
    {
      "logical_repo_path": "multimedia/2026-09-25/B01_green-checkmark__E_none/S019__0136-0140s__researcher-working-with-notes-team-research-disc.jpg",
      "absolute_path": "/home/runner/work/AI-News-Daily/AI-News-Daily/.pipeline-runs/2026-09-25/36467553743/multimedia/2026-09-25/B01_green-checkmark__E_none/S019__0136-0140s__researcher-working-with-notes-team-research-disc.jpg",
      "bin": "02_B-Roll",
      "exists": true,
      "placeholder": false
    },
    {
      "logical_repo_path": "multimedia/2026-09-25/B01_green-checkmark__E_none/S022__0166-0168s__researcher-working-with-notes-equipment-and-work.jpg",
      "absolute_path": "/home/runner/work/AI-News-Daily/AI-News-Daily/.pipeline-runs/2026-09-25/36467553743/multimedia/2026-09-25/B01_green-checkmark__E_none/S022__0166-0168s__researcher-working-with-notes-equipment-and-work.jpg",
      "bin": "02_B-Roll",
      "exists": true,
      "placeholder": false
    },
    {
      "logical_repo_path": "multimedia/2026-09-25/B02_when-persistence-crosses-a-line__E_medicare-access-boundary/S023__0168-0173s__introducir-el-caso-australiano-como-prueba-de-qu.jpg",
      "absolute_path": "/home/runner/work/AI-News-Daily/AI-News-Daily/.pipeline-runs/2026-09-25/36467553743/multimedia/2026-09-25/B02_when-persistence-crosses-a-line__E_medicare-access-boundary/S023__0168-0173s__introducir-el-caso-australiano-como-prueba-de-qu.jpg",
      "bin": "02_B-Roll",
      "exists": true,
      "placeholder": false
    },
    {
      "logical_repo_path": "multimedia/2026-09-25/B02_when-persistence-crosses-a-line__E_medicare-access-boundary/S025__0188-0193s__scientist-reviewing-evidence-and-research-data-o.mp4",
      "absolute_path": "/home/runner/work/AI-News-Daily/AI-News-Daily/.pipeline-runs/2026-09-25/36467553743/multimedia/2026-09-25/B02_when-persistence-crosses-a-line__E_medicare-access-boundary/S025__0188-0193s__scientist-reviewing-evidence-and-research-data-o.mp4",
      "bin": "02_B-Roll",
      "exists": true,
      "placeholder": false
    },
    {
      "logical_repo_path": "multimedia/2026-09-25/B02_when-persistence-crosses-a-line__E_medicare-access-boundary/S028__0218-0223s__scientist-reviewing-evidence-and-research-data-s.jpg",
      "absolute_path": "/home/runner/work/AI-News-Daily/AI-News-Daily/.pipeline-runs/2026-09-25/36467553743/multimedia/2026-09-25/B02_when-persistence-crosses-a-line__E_medicare-access-boundary/S028__0218-0223s__scientist-reviewing-evidence-and-research-data-s.jpg",
      "bin": "02_B-Roll",
      "exists": true,
      "placeholder": false
    },
    {
      "logical_repo_path": "multimedia/2026-09-25/B02_when-persistence-crosses-a-line__E_medicare-access-boundary/S030__0238-0243s__scientist-reviewing-evidence-and-research-data-t.jpg",
      "absolute_path": "/home/runner/work/AI-News-Daily/AI-News-Daily/.pipeline-runs/2026-09-25/36467553743/multimedia/2026-09-25/B02_when-persistence-crosses-a-line__E_medicare-access-boundary/S030__0238-0243s__scientist-reviewing-evidence-and-research-data-t.jpg",
      "bin": "02_B-Roll",
      "exists": true,
      "placeholder": false
    },
    {
      "logical_repo_path": "multimedia/2026-09-25/B02_when-persistence-crosses-a-line__E_medicare-access-boundary/S033__0268-0273s__scientist-reviewing-evidence-and-research-data-m.mp4",
      "absolute_path": "/home/runner/work/AI-News-Daily/AI-News-Daily/.pipeline-runs/2026-09-25/36467553743/multimedia/2026-09-25/B02_when-persistence-crosses-a-line__E_medicare-access-boundary/S033__0268-0273s__scientist-reviewing-evidence-and-research-data-m.mp4",
      "bin": "02_B-Roll",
      "exists": true,
      "placeholder": false
    },
    {
      "logical_repo_path": "multimedia/2026-09-25/B02_when-persistence-crosses-a-line__E_medicare-access-boundary/S036__0298-0303s__scientist-reviewing-evidence-and-research-data-n.jpg",